{
  "identity": "provider-neutral-runtime-parked-deploy-token-verify-20261011-r2",
  "state": "CONSUMED_BEFORE_REMOTE",
  "prepared_commit_sha": "f9fd4f7b0faca60821dafbda86239d8c9104dbc1",
  "workflow_sha256": "4b7bdab9e48e15b1501b0523b932ace304f4baa5109f62081e3aaf910cabbff9",
  "executor_sha256": "8017f3bb0b2aa82b17b2913775e817afac90ca3610637733c3ab6687c986161f",
  "plan_sha256": "1ad3d111d05996b4732ec2a30b99bd6333eac561ef7a5d79042041a05bbfe468",
  "schema_sha256": "a4fa1237779859ad1c0b45926e0f395bc650754ed7c725c8ffa1f9862b30b4d3",
  "parked_deploy_plan_sha256": "b96edafbbc0df5121eda655bd1fa12af6dc086f9b2077982410c97f740851985",
  "parked_deploy_executor_sha256": "56163be0825d3cc240e85eef8a757ee2a50a2ea92380979aa3fae81a8a9f795d",
  "parser_dependency_sha256": "4e5c746374757d77baf053c46c7516f65298f3cedbd8d37f6dea09242e619ee6",
  "expected_old_source_sha256": "6c5d726f96d56dac792ff739f87227926197891f1149b1dedeeac38e67128451",
  "expected_new_bundle_sha256": "8a6615fd020ca6590ba8f5e2c73a3844473d9e6ecd3babb19ea836d604d4a8a9",
  "r1_consumed_marker_sha256": "44275c75b3c0b1f4ac13cf4d6e73ec591ffec6f5760f9900a8d56d8cccca8e2d"
}
